{
  "$schema": "https://json-schema.org/draft/2020-12/schema",
  "$id": "https://chargesentinel.local/schemas/availability_output.schema.json",
  "title": "Availability prediction output",
  "type": "object",
  "additionalProperties": false,
  "required": ["charger_id", "predicted_duration_minutes", "expected_free_time", "expected_wait_minutes", "anomaly_risk", "model_version", "bundle_version", "config_version", "schema_version", "limitations"],
  "properties": {
    "charger_id": {"type": "string"},
    "predicted_duration_minutes": {"type": "number", "minimum": 0},
    "expected_free_time": {"type": "string", "pattern": "^\\d{4}-\\d{2}-\\d{2}T\\d{2}:\\d{2}:\\d{2}(\\.\\d+)?([+-]\\d{2}:\\d{2}|Z)?$"},
    "expected_wait_minutes": {"type": "number", "minimum": 0},
    "anomaly_risk": {"type": ["number", "null"], "minimum": 0, "maximum": 1},
    "model_version": {"type": "string", "minLength": 1},
    "bundle_version": {"type": "string", "minLength": 1},
    "config_version": {"type": "string", "minLength": 1},
    "schema_version": {"const": "availability-output-v1"},
    "limitations": {"type": "array", "items": {"type": "string", "minLength": 1}},
    "explanation": {
      "oneOf": [
        {"type": "null"},
        {
          "type": "object", "additionalProperties": false,
          "required": ["unit", "base_value", "top_contributors", "note"],
          "properties": {
            "unit": {"const": "log_minutes"},
            "base_value": {"type": "number"},
            "top_contributors": {
              "type": "array", "maxItems": 5,
              "items": {
                "type": "object", "additionalProperties": false,
                "required": ["feature", "value", "contribution", "direction"],
                "properties": {
                  "feature": {"type": "string"},
                  "value": {"type": "number"},
                  "contribution": {"type": "number"},
                  "direction": {"enum": ["increases", "decreases"]}
                }
              }
            },
            "note": {"type": "string", "minLength": 1}
          }
        }
      ]
    },
    "explanation_note": {"type": "string", "minLength": 1}
  }
}
